{
  "schemaVersion": 1,
  "harmony": {
    "registrationToken": "REPLACE_WITH_HARMONY_REGISTRATION_TOKEN",
    "cloudUrl": "https://your-harmony-cloud.example",
    "agentGroupId": 12345
  },
  "agent": {
    "namePrefix": "customer-pa"
  },
  "registration": {
    "deregisterOnDrainstop": false,
    "retryCount": 10,
    "retryIntervalSeconds": 5
  }
}
